"subject","question","correct_response","response","trial_index"
"1854","32","Is 6 a generator under <img src=./images/nonagon_symbol.png style=width:14px;height:14px>? Please explain in words how you got your answer.","","No. You will only make 3, 6, and 0.",63
"1909","33","Is 2 a generator under +<sub>9</sub>? Please explain in words how you got your answer.","","Seven, because two plus seven equals nine, then mine nine to equal zero.",60
"1910","33","Is 3 a generator under +<sub>9</sub>? Please explain in words how you got your answer.","","No, because you can't get other numbers from three.",61
"1911","33","Is 5 a generator under +<sub>9</sub>? Please explain in words how you got your answer.","","No because you can't get six, seven or eight from 5",62
"1912","33","Is 6 a generator under +<sub>9</sub>? Please explain in words how you got your answer.","","no, because you can't get seven or eight from six.",63
"1967","34","Is 2 a generator under <img src=./images/nonagon_symbol.png style=width:14px;height:14px>? Please explain in words how you got your answer.","","No, they do not add up to all numbers.",60
"1968","34","Is 3 a generator under <img src=./images/nonagon_symbol.png style=width:14px;height:14px>? Please explain in words how you got your answer.","","No, they do not add up to all numbers.",61
"1969","34","Is 5 a generator under <img src=./images/nonagon_symbol.png style=width:14px;height:14px>? Please explain in words how  you got  your answer.","","Yes, they all add up to all the numbers on the nonagram.",62
"1970","34","Is 6 a generator under <img src=./image s/nonagon_symbol.png style=width:14px;height:14px>? Please explain in words how you got your answer.","","No, because they only involve the numbers 0, 3, and 6.",63
"2025","35","Is 2 a generator under +<sub>9</sub>? Please explain in words how you got your answer.","","I don't know this part confused me",60
"2026","35","Is 3 a generator under +<sub>9</sub>? Please explain in words how you got your answer.","","I don't know this part confused me",61
"2027","35","Is 5 a generator under +<sub>9</sub>? Please explain in words how you got your answer.","","I don't know this part confused me",62
"2028","35","Is 6 a generator under +<sub>9</sub>? Please explain in words how you got your answer.","","I don't know this part confused me",63
"2083","36","Is 2 a generator under <img src=./images/nonagon_symbol.png style=width:14px;height:14px>? Please explain in words how you got your answer.","","no because I don't think 2 can make 3 or 5 still.",60
"2084","36","Is 3 a generator under <img src=./images/nonagon_symbol.png style=width:14px;height:14px>? Please explain in words how you got your answer.","","no, 3 is still a multiple of the function and wouldn't create 5 or something like that",61
"2085","36","Is 5 a generator under <img src=./images/nonagon_symbol.png style=width:14px;height:14px>? Please explain in words how you got your answer.","","Yes, 5 will be able to combine moves to make all the other numbers eventually",62
"2086","36","Is 6 a generator under <img src=./images/nonagon_symbol.png style=width:14px;height:14px>? Please explain in words how you got your answer.","","no, six will only make 6, 3, and 0",63
"2141","37","Is 2 a generator under <img src=./images/nonagon_symbol.png style=width:14px;height:14px>? Please explain in words how you got your answer.","","yes, even numbers are generators under odd points",60
"2142","37","Is 3 a generator under <img src=./images/nonagon_symbol.png style=width:14px;height:14px>? Please explain in words how you got your answer.","","no, divisible by 9",61
"2143","37","Is 5 a generator under <img src=./images/nonagon_symbol.png style=width:14px;height:14px>? Please explain in words how you got your answer.","","no, not divisible by 9",62
"2144","37","Is 6 a generator under <img src=./images/nonagon_symbol.png style=width:14px;height:14px>? Please explain in words how you got your answer.","","no, share 3 as common denominator which means they repeat a pattern instead of progress through all numbers",63
"2199","38","Is 2 a generator under <img s rc=./i mages/nonagon_symbol.png style=width:14px;height:14px>? Please explain in words how you got your answer.","","No because you can't use it with 3,5, etc.",60
"2200","38","Is 3 a generator under <img src=./images/nonagon_symbol.png style=width:14px;height:14px>? Please explain in words how y ou got y our answer.","","Yes, I am not sure. I think because you can use it with every number to get to 0",61
"2201","38","Is 5 a generator under <img src=./images/nonagon_symbol.png style=width:14px;height:14px>? Please explain in words how you got your answer.","","No, I don't know.",62
"2202","38","Is 6 a generator under <img src=./images/nonagon_symbol.png style=width:14px;height:14px>? Please explain in words how you got your answer.","","No, I am not sure.",63
"2257","39","Is 2 a generator under +<sub>9</sub>? Please explain in words how you got your answer.","","I have no idea",60
"2258","39","Is 3 a generator under +<sub>9</sub>? Please explain in words how you got your answer.","","Idk",61
"2259","39","Is 5 a generator under +<sub>9</sub>? Please explain in words how you got your answer.","","I dont know",62
"2260","39","Is 6 a generator under +<sub>9</sub>? Please explain in words how you got your answer.","","I don't think so",63
"2315","40","Is 2 a generator under <img src=./images/nonagon_symbol.png style=width:14px;height:14px>? Please explain in words how you got your answer.","","No because it doesn't generate. ",60
"2316","40","Is 3 a generator under <img src=./imag es/nonag on_symbol.png style=width:14px;height:14px>? Please explain in words how you got your answer.","","Yes because it does generate. ",61
"2317","40","Is 5 a generator under <img src=./images/nonagon_symbol.png style=width:14px;height:14px>? Please explain in words how you got your answer.","","No because it doesn't generate.",62
"2318","40","Is 6 a  generato r under <img src=./images/nonagon_symbol.png style=width:14px;height:14px>? Please explain in words how you got your answer.","","No because it doesn't generate.",63
"2373","41","Is 2 a generator under <img src=./images/nonagon_symbol.png style=width:14px;height:14px>? Please explain in words how you got your answer.","","Yes. I moved clockwise incrementally by 2 an d noted  that 2 becomes 4 becomes 6 becomes 8 becomes 1 becomes 3 becomes 5 becomes 7 becomes 0.",60
"2374","41","Is 3 a generator under <img s rc=./i mages/nonagon_symbol.png style=width:14px;height:14px>? Please explain in words how you got your answer.","","No, I only got 3, 6, and 0 when moving clockwise by 3.",61
"2375","41","Is 5 a generator under <img src=./images/nonagon_symbol.png style=width:14px;height:14px>? Please explain in words how you got your answer.","","Yes. I mo ved cloc kwise in 5s and got 5, 1, 6, 2, 7, 3, 8, 4, and 0",62
"2376","41","Is 6 a generator under <img src=./images/nonagon_symbol.png style=width:14px;height:14px>? Please explain in words how you got your answer.","","No. Same reasons for why 3 is not a generator.",63
"2431","42","Is 2 a generator under <img src=./images/nonagon_symbol.png style= width: 14px;height:14px>? Please explain in words how you got your answer.","","Yes. Because it equals up to 0 on the hexagon.",60
"2432","42","Is 3 a  generato r under <img src=./images/nonagon_symbol.png style=width:14px;height:14px>? Please explain in words how you got your answer.","","Yes. Because it equals up to 0 on the hexagon.",61
"2433","42","Is 5 a generator under <img src=./images/nonagon_symbol.png style=width:14px;height:14px>? Please explain in words how you got your answer.","","Yes because it equals up to 0 on the hexagon.",62
"2434","42","Is 6 a generator under <img src=./images/nonagon_symbol.png style=width:14px;height:14px>? Please explain in words how you got your answer.","","Yes because it is equalled on the hexagon.",63
"2489","43","Is 2 a generator under <img src=./images/nonagon_symbol.png style=width:14px;height:14px>? Please explain in words how you got your answer.","","yes adding two in sequence will land on all of the dots corresponding to all of the numbers",60
"2490","43","Is 3 a generator under <img src=./images/nonagon_symbol.png style=width:14px;height:14px>? Please explain in words how you got your answer.","","no.  Adding 3 in sequence will only land on 3,6, and 0",61
"2491","43","Is 5 a generator under <img src=./images/nonagon_symbol.png style=width:14px;height:14px>? Please explain in words how you got your answer.","","Yes Adding 5 in sequence will land on every dot",62
"2492","43","Is 6 a generator under <img src=./images/nonagon_symbol.png style=width:14px;height:14px>? Please explain in words how you got your answer.","","No adding 6 will only get 3,6 and 0 as a result",63
"2547","44","Is 2 a g enerator  under <img src=./images/nonagon_symbol.png style=width:14px;height:14px>? Please explain in words how you got your answer.","","Yes because 2 can be used to reach every number",60
"2548","44","Is 3 a generator under <img src=./images/nonagon_symbol.png style=width:14px;height:14px>? Please explain in words how you got your answer.","","No because 3 can only be used to reach 3,6,0",61
"2549","44","Is 5 a generator under <img src=./images/nonagon_symbol.png style=width:14px;height:14px>? Please explain in words how you got your answer.","","Yes because 5 can be used to reach every number.",62
"2550","44","Is 6 a generator under <img src=./images/nonagon_symbol.png style=width:14px;height:14px>? Please explain in words how you got your answer.","","No because 6 can only reach 6,3,0",63
"2605","45","Is 2 a generator under <img src=./images/nonagon_symbol.png style=width:14px;height:14px>? Please explain in words how you got your answer.","","No, you can't make every other number an element.",60
"2606","45","Is 3 a generator under <img src=./images/nonagon_symbol.png style=width:14px;height:14px>? Please explain in words how you got your answer.","","No, yo u can't  make every other number.",61
"2607","45","Is 5 a generator under <img src=./images/nonagon_symbol.png style=width:14px;height:14px>? Please explain in words how you got your answer.","","No, you can't make every other number.",62
"2608","45","Is 6 a generator under <img src=./images/nonagon_symbol.png style=width:14px;height:14px>? Please explain in words how you got your answer.","","No, you can't make every other number.",63
"2663","46","Is 2 a generator under <img src=./images/nonagon_symbol.png style=width:14px;height:14px>? Please explain in words how you got your answer.","","I do not know.",60
"2664","46","Is 3 a generator under <img src=./images/nonagon_symbol.png style=width:14px;height:14px>? Please explain in words how you got your answer.","","I do not know.",61
"2665","46","Is 5 a generator under <img src=./images/nonagon_symbol.png style=width:14px;height:14px>? Please explain in words how you got your answer.","","I do not know.",62
"2666","46","Is 6 a generator under <img src=./images/nonagon_symbol.png style=width:14px;height:14px>? Please explain in words how you got your answer.","","I do not know.",63
"2721","47","Is 2 a generator under +<sub>9</sub>? Please explain in words how you got your answer.","","No. You can only get 2 and 1 as results.",60
"2722","47","Is 3 a generator under +<sub>9</sub>? Please explain in words how you got your answer.","","No, you will only get multiples of 3.",61
"2723","47","Is 5 a generator under +<sub>9</sub>? Please explain in words how you got your answer.","","Yes, you can hit every number.",62
"2724","47","Is 6 a generator under +<sub>9</sub>? Please explain in words how you got your answer.","","No, you can only get multiples of 3.",63
"2779","48","Is 2 a generator under +<sub>9</sub>? Please explain in words how you got your answer.","","2 yes because it can equal 9",60
"2780","48","Is 3 a generator under +<sub>9</sub>? Please explain in words how you got your answer.","","yes because all can equal 9",61
"2781","48","Is 5 a generator under +<sub>9</sub>? Please explain in words how you got your answer.","","no only 4 can equal 9",62
"2782","48","Is 6 a generator under +<sub>9</sub>? Please explain in words how you got your answer.","","no because only 3 can equal 9",63
"2837","49","Is 2 a generator under <img src=./images/nonagon_symbol.png style=width:14px;height:14px>? Please explain in words how you got your answer.","","no, because I can't make 1, 3, 5 using 2",60
"2838","49","Is 3 a generator under <img src=./images/nonagon_symbol.png style=width:14px;height:14px>? Please explain in words how you got your answer.","","no",61
"2839","49","Is 5 a generator under <img src=./images/nonagon_symbol.png style=width:14px;height:14px>? Please explain in words how you got your answer.","","yes, I can make all the numbers using 5 ",62
"2840","49","Is 6 a generator under <img src=./images/nonagon_symbol.png style=width:14px;height:14px>? Please explain in words how you got your answer.","","no ",63
"2895","50","Is 2 a generator under <img src=./images/nonagon_symbol.png style=width:14px;height:14px>? Please explain in words how you got your answer.","","Yes because if you successively move 2 spaces across the nonagon you can reach every number.",60
"2896","50","Is 3 a generator under <img src=./images/nonagon_symbol.png style=width:14px;height:14px>? Please explain in words how you got your answer.","","No because you cannot reach every number if you go 3 spaces successively around the nonagon.",61
"2897","50","Is 5 a generator under <img src=./images/nonagon_symbol.png style=width:14px;height:14px>? Please explain in words how you got your answer.","","Yes because if you successively take 5 steps across the nonagon, you can reach every single number.",62
"2898","50","Is 6 a generator under <img src=./images/nonagon_symbol.png style=width:14px;height:14px>? Please explain in words how you got your answer.","","No, because if you take six spaces across the nonagon successively, you cannot reach every number. ",63
"2953","51","Is 2 a generator under <img src=./images/nonagon_symbol.png style=width:14px;height:14px>? Please explain in words how you got your answer.","","yes because can create ever number under 9 (i think)",60
"2954","51","Is 3 a generator under <img src=./images/nonagon_symbol.png style=width:14px;height:14px>? Please e xplain i n words how you got your answer.","","no, i dont know why",61
"2955","51","Is 5 a generator under <img src=./images/nonagon_symbol.png style=width:14px;height:14px>? Please explain in words how you got your answer.","","no, not sure",62
"2956","51","Is 6 a generator under <img src=./images/nonagon_symbol.png style=width:14px;height:14px>? Please explain in words how you got your answ er.","","yes, no idea",63
"3011","52","Is 2 a generator under <img src=./images/nonagon_symbol.png style=width:14px;height:14px>? Please explain in words how you got your answer.","","no because using 2 I can't get 1,3,5 ",60
"3012","52","Is 3 a  generator under <img src=./images/nonagon_symbol.png style=width:14px;height:14px>? Please explain in words how you got your answer.","","no, using 3 I can't get 1,2,4,5,7,8",61
"3013","52","Is 5 a generator under <img src=./images/nonagon_symbol.png style=width:14px;height:14px>? Please explain in words how you got your answer.","","yes, I can get all the numbers ",62
"3014","52","Is 6 a generator under <img src=./images/nonagon_symbol.png style=width:14px;height:14px>? Please explain in words how you got your answer.","","no ",63
"3069","53","Is 2 a generator under <img src=./images/nonagon_symbol.png style=width:14px;height:14px>? Please explain in words how you got your answer.","","Yes because I can use 2 to get to every point",60
"3070","53","Is 3 a generator under <img src=./images/nonagon_symbol.png style=width:14px;height:14px>? Please explain in words how you got your answer.","","No because I can only get 0, 3, 6, or 9, using 3 ",61
"3071","53","Is 5 a generator under <img src=./images/nonagon_symbol.png style=width:14px;height:14px>? Please explain in words how you got your answer.","","Yes because I can get every number by using 5",62
"3072","53","Is 6 a generator under <img src=./images/nonagon_symbol.png style=width:14px;height:14px >? Pleas e explain in words how you got your answer.","","No becasue I can only get 0, 3, or 6 using 6",63
"3127","54","Is 2 a generator under <img src=./images/nonagon_symbol.png style=width:14px;height:14px>? Please explain in words how you got your answer.","","yes it is because you can make every num ber with  2",60
"3128","54","Is 3 a generator under <img src=./images/nonagon_symbol.png style=width:14px;height:14px>? Please explain in words how you got your answer.","","no because you can make 4,5,7,8,1,2",61
"3129","54","Is 5 a generator under <img sr c=./im ages/nonagon_symbol.png style=width:14px;height:14px>? Please explain in words how you got your answer.","","yes because you can make every number with 5",62
"3130","54","Is 6 a generator under <img src=./images/nonagon_symbol.png style=width:14px;height:14px>? Please explain in words how you got your answer.","","no because you cant make 1, 2, 4, 5 ,7 ,8",63
"3185","55","Is 2 a generator under <img src=./images/nonagon_symbol.png style=width:14px;height:14px>? Please explain in words how you got your answer.","","Yes, I can generate every number using 2",60
"3186","55","Is 3 a generator under <img  src=. /images/nonagon_symbol.png style=width:14px;height:14px>? Please explain in words how you got your answer.","","No, there isn't a way to get 1 using 3",61
"3187","55","Is 5 a generator under <img src=./images/nonagon_symbol.png style=width:14px;height:14px>? Please explain in words how you got your answer.","","No, there is not a way to get 5 when starting with 5",62
"3188","55","Is 6 a generator under <img src=./images/nonagon_symbol.png style=width:14px;height:14px>? Please explain in words how you got your answer.","","Yes, I can get all other numbers from 6",63
"3243","56","Is 2 a generator under +<sub>9</sub>? Please explain in words how you got your answer.","","No, you can get number 4, 6, and 8. But there is no way to make numbers 1, 3, 5, and 7. ",60
"3244","56","Is 3 a generator under +<sub>9</sub>? Please explain in words h ow you g ot your answer.","","No. You can get numbers 0, 3, 6. But there is no way to get numbers 2, 4, 6, and 8. ",61
"3245","56","Is 5 a generator under +<sub>9</sub>? Please explain in words how you got your answer.","","No, you are unable to make numbers 2, 3, 4, 5, 7, and 8 using successive operations of 5. ",62
"3246","56","Is 6 a generator under +<sub>9</sub>? Please explain in words how you got your answer.","","No, you are unable to numbers like 1, 2, 4, 5, 6, 7, and 8 using successive operations of 6. ",63
"3301","57","Is 2 a generator under <img src=./images/nonagon_symbol.png style=width:14px;height:14px>? Please explain in words how you got your answer.","","Yes, because 2 is not a factor of 9 and it is not 0.",60
"3302","57","Is 3 a generator under <img src=./images/nonagon_symbol.png style=width:14px;height:14px>? Please explain in words how you got your answer.","","No, because it is a factor of 9.",61
"3303","57","Is 5 a generator under <img src=./images/nonagon_symbol.png style=width:14px;height:14px>? Please explain in words how you got your answer.","","Yes, because it is not a factor of 9 and it is not 0. ",62
"3304","57","Is 6 a generator under <img src=./images/nonagon_symbol.png style=width:14px;height:14px>? Please explain in words how you got your answer.","","No, because it is a multiple of a factor of 9.",63
"3359","58","Is 2 a generator under <img src=./images/nonagon_symbol.png style=width:14px;height:14px>? Please explain in words how you got your answer.","","no, because you can't make 1,3,5,7 using 2. ",60
"3360","58","Is 3 a generator under <img src=./images/nonagon_symbol.png style=width:14px;height:14px>? Please explain in words how you got your answer.","","no. ",61
"3361","58","Is 5 a generator under <img src=./images/nonagon_symbol.png style=width:14px;height:14px>? Please explain in words how you got your answer.","","yes, you can make all the numbers using 5. ",62
"3362","58","Is 6 a generator under <img src=./images/nonagon_symbol.png style=width:14px;height:14px>? Please explain in words how you got your answer.","","no",63
"3417","59","Is 2 a generator under <img src=./images/nonagon_symbol.png style=width:14px;height:14px>? Please explain in words how you got your answer.","","no because 2 cannot be added to equal 9",60
"3418","59","Is 3 a generator under <img src=./images/nonagon_symbol.png style=width:14px;height:14px>? Please explain in words how you got your answer.","","yes because 3 and 6 equals 9",61
"3419","59","Is 5 a generator under <img src=./images/nonagon_symbol.png style=width:14px;height:14px>? Please explain in words how you got your ans wer.","","no because 5 cannot be paired with a number to equal 9",62
"3420","59","Is 6 a generator under <img src=./images/nonagon_symbol.png style=width:14px;height:14px>? Please explain in words how you got your answer.","","yes because 6 and 3 equal 9",63
"3485","60","Is 2 a generator under +<sub>9</sub>? Pl ease exp lain in words how you got your answer.","","No, it's not 1,3,5",80
"3486","60","Is 3 a generator under +<sub>9</sub>? Please explain in words how you got your answer.","","No it's not 1,3,5",81
"3487","60","Is 5 a generator under +<sub>9</sub>? Please explain in words how you got your answer.","","No it's not 1,3,5",82
"3488","60","Is 6 a generator under +<sub>9</sub>? Please explain in words how you got your answer.","","No...It's not 1,3,5",83
"3543","61","Is 2 a generator under +<sub>9</sub>? Pl ease exp lain in words how you got your answer.","","No. You are not able to combine with the other numbers and stay below 9",60
"3544","61","Is 3 a generator under +<sub>9</sub>? Please explain in words how you got your answer.","","No. You are not able t o achiev e all outcomes without exceeding 9",61
"3545","61","Is 5 a generator under +<sub>9</sub>? Please explain in words how you got your answer.","","No. You are not able to achieve all numbers without exceeding 9",62
"3546","61","Is 6 a generator under +<sub>9</sub>? Please explain in words how you got your answer.","","No. You are not able to achieve all numbers without exceeding 9",63
"3601","62","Is 2 a generator under <img src=./images/nonagon_symbol.png style=width:14px;height:14px>? Please explain in words how you got your answer.","","no it cant be made for odd numbers",60
"3602","62","Is 3 a generator under <img src=./images/nonagon_symbol.png style=width:14px;height:14px>? Please explain in words how you got your answer.","","yes it can be made multiples of odds and evens",61
"3603","62","Is 5 a generator under <img src=./images/nonagon_symbol.png style=width:14px;height:14px>? Please explain in words how you got your answer.","","no it cant ",62
"3604","62","Is 6 a generator under <img src=./images/nonagon_symbol.png style=width:14px;height:14px>? Please explain in words how you got your answer.","","no its too big",63
"3659","63","Is 2 a generator under +<sub>9</sub>? Please explain in words how you got your answer.","","2+2=4. 4",60
"3660","63","Is 3 a generator  under +< sub>9</sub>? Please explain in words how you got your answer.","","3+3 is 6. 6 is the answer",61
"3661","63","Is 5 a generator under +<sub>9</sub>? Please explain in words how you got your answer.","","5+5 is 10-9 is 1",62
"3662","63","Is 6 a generator under +<sub>9</sub>? Please explain in words how you got your answer.","","I dont know.",63
"3717","64","Is 2 a generator under <img src=./images/nonagon_symbol.png style=width:14px;height:14px>? Please explain in words how you got your answer.","","no. i guessed",60
"3718","64","Is 3 a generator under <img src=./images/nonagon_symbol.png style=width:14px;height:14px>? Please explain in words how you got your answer.","","yes. i guessed",61
"3719","64","Is 5 a generator under <img src=./images/nonagon_symbol.png style=width:14px;height:14px>? Please explain in words how you got your answer.","","y es. i guessed",62
"3720","64","Is 6 a generator under <img src=./images/nonagon_symbol.png style=width:14px;height:14px>? Please explain in words how you got your answer.","","no, i guessed",63
"3775","65","Is 2 a generator under <img src=./images/nonagon_symbol.png style=width:14px;height:14px>? Please explain in words how you got your answer.","","I'm not sure",60
"3776","65","Is 3 a generator under <img src=./images/nonagon_symbol.png style=width:14px;height:14px>? Please explain in words how you got your answer.","","I'm not sure",61
"3777","65","Is 5 a generator under <img src=./images/nonagon_symbol.png style=width:14px;height:14px>? Please explain in words how you got your answer.","","Yes, just guessing, cannot remember exactly",62
"3778","65","Is 6 a generator under <img src=./images/nonagon_symbol.png style=width:14px;height:14px>? Please explain in words how you got your answer.","","Not sure",63
"3833","66","Is 2 a generator under +<sub>9</sub>? Please explain in words how you got your answer.","","I honestly don't understand this definition.",60
"3834","66","Is 3 a generator under +<sub>9</sub>? Please explain in words how you got your answer.","","I honestly don't understand this definition.",61
"3835","66","Is 5 a generator under +<sub>9</sub>? Please explain in words how you got your answer.","","I honestly don't understand this definition.",62
"3836","66","Is 6 a generator under +<sub>9</sub>? Please explain in words how you  got your  answer.","","I honestly don't understand this definition.",63
